<?xml version="1.0" encoding="UTF-8"?>
<list xmlns:xsi="http://www.w3.org/2001/XMLSchema-instance" xsi:noNamespaceSchemaLocation="../xsd/multisell.xsd">
	<item>
		<!-- Adena -->
		<ingredient count="13200" id="57" />
		<!-- Transformation Scroll: Dion Human Mercenary -->
		<production count="1" id="13581" />
	</item>
	<item>
		<!-- Adena -->
		<ingredient count="13200" id="57" />
		<!-- Transformation Scroll: Dion Elf Mercenary -->
		<production count="1" id="13582" />
	</item>
	<item>
		<!-- Adena -->
		<ingredient count="13200" id="57" />
		<!-- Transformation Scroll: Dion Dark Elf Mercenary -->
		<production count="1" id="13583" />
	</item>
	<item>
		<!-- Adena -->
		<ingredient count="13200" id="57" />
		<!-- Transformation Scroll: Dion Orc Mercenary -->
		<production count="1" id="13584" />
	</item>
	<item>
		<!-- Adena -->
		<ingredient count="13200" id="57" />
		<!-- Transformation Scroll: Dion Dwarf Mercenary -->
		<production count="1" id="13585" />
	</item>
	<item>
		<!-- Adena -->
		<ingredient count="13200" id="57" />
		<!-- Transformation Scroll: Dion Kamael Mercenary -->
		<production count="1" id="13586" />
	</item>
	<item>
		<!-- Adena -->
		<ingredient count="70000" id="57" />
		<!-- Dion Disguise Scroll -->
		<production count="1" id="13678" />
	</item>
	<item>
		<!-- Adena -->
		<ingredient count="27800" id="57" />
		<!-- Dion Territory Badge -->
		<ingredient count="5" id="13758" />
		<!-- Transformation Scroll: Dion Archer Mercenary -->
		<production count="1" id="13588" />
	</item>
	<item>
		<!-- Adena -->
		<ingredient count="27800" id="57" />
		<!-- Dion Territory Badge -->
		<ingredient count="5" id="13758" />
		<!-- Transformation Scroll: Dion Wizard Mercenary -->
		<production count="1" id="13589" />
	</item>
	<item>
		<!-- Adena -->
		<ingredient count="27800" id="57" />
		<!-- Dion Territory Badge -->
		<ingredient count="5" id="13758" />
		<!-- Transformation Scroll: Dion Kamael Captain Mercenary -->
		<production count="1" id="13590" />
	</item>
	<item>
		<!-- Adena -->
		<ingredient count="13900" id="57" />
		<!-- Dion Territory Badge -->
		<ingredient count="16" id="13758" />
		<!-- Red Talisman - Territory Guard -->
		<production count="1" id="14605" />
	</item>
</list>