<?xml version="1.0" encoding="UTF-8"?>
<list xmlns:xsi="http://www.w3.org/2001/XMLSchema-instance" xsi:noNamespaceSchemaLocation="../xsd/multisell.xsd">
	<npcs>
		<npc>31756</npc> <!-- Mr. Cat (Test Server Helper) -->
		<npc>31757</npc> <!-- Miss Queen (Test Server Helper) -->
	</npcs>
	<item>
		<!-- Gludio Territory Badge -->
		<ingredient count="30" id="13757" />
		<!-- Gracian Anniversary Coins  -->
		<production count="1" id="13693" />
	</item>
	<item>
		<!-- Dion Territory Badge -->
		<ingredient count="30" id="13758" />
		<!-- Gracian Anniversary Coins  -->
		<production count="1" id="13693" />
	</item>
	<item>
		<!-- Giran Territory Badge -->
		<ingredient count="30" id="13759" />
		<!-- Gracian Anniversary Coins  -->
		<production count="1" id="13693" />
	</item>
	<item>
		<!-- Oren Territory Badge -->
		<ingredient count="30" id="13760" />
		<!-- Gracian Anniversary Coins  -->
		<production count="1" id="13693" />
	</item>
	<item>
		<!-- Aden Territory Badge -->
		<ingredient count="30" id="13761" />
		<!-- Gracian Anniversary Coins  -->
		<production count="1" id="13693" />
	</item>
	<item>
		<!-- Innadril Territory Badge -->
		<ingredient count="30" id="13762" />
		<!-- Gracian Anniversary Coins  -->
		<production count="1" id="13693" />
	</item>
	<item>
		<!-- Goddard Territory Badge -->
		<ingredient count="30" id="13763" />
		<!-- Gracian Anniversary Coins  -->
		<production count="1" id="13693" />
	</item>
	<item>
		<!-- Rune Territory Badge -->
		<ingredient count="30" id="13764" />
		<!-- Gracian Anniversary Coins  -->
		<production count="1" id="13693" />
	</item>
	<item>
		<!-- Schuttgart Territory Badge -->
		<ingredient count="30" id="13765" />
		<!-- Gracian Anniversary Coins  -->
		<production count="1" id="13693" />
	</item>
	<item>
		<!-- Olympiad Token -->
		<ingredient count="5000" id="13722" />
		<!-- Emery Piece -->
		<ingredient count="5" id="13749" />
		<!-- Gracian Anniversary Coins  -->
		<production count="1" id="13693" />
	</item>
</list>